{
  "schema": "cp-plan-change-set-v1",
  "id": "ADHOC-tic-tac-toe-d45a",
  "revision": 2,
  "title": "Tic-Tac-Toe: React, 0-2 Human Players",
  "author": "Operator (conversation); source retained by GitHub Copilot",
  "created_at": "2026-09-29T17:15:44.820639+00:00",
  "context": {
    "id": "ADHOC-tic-tac-toe-d45a",
    "kind": "ad-hoc"
  },
  "status": "draft",
  "capture": {
    "id": "capture",
    "path": "control-plane/ad-hoc/ADHOC-tic-tac-toe-d45a/ADHOC-tic-tac-toe-d45a-capture.md",
    "sha256": "369abe1882a617b6197535483aa2f5a49b93de2deb82989980b515e9c59d9e13"
  },
  "base": {
    "target_ref": "refs/heads/main",
    "git_commit": "b26b33700e99f00c7edd1e46a0840c175f86aa90",
    "path": "control-plane/operational/SPECIFICATION.json",
    "revision": 0,
    "sha256": "faae0d5014d2a32deb40b89b11bee98780f943d45992d90090c6e25cf0962813"
  },
  "sources": [
    {
      "id": "source-1",
      "path": "control-plane/ad-hoc/ADHOC-tic-tac-toe-d45a/assets/history/001-conversation-source.md",
      "sha256": "d6139844ec225d1e36ddd07d9552bc8aa1a64fc14a38fc6b935560f49bea69ed"
    },
    {
      "id": "source-2",
      "path": "control-plane/ad-hoc/ADHOC-tic-tac-toe-d45a/assets/history/002-play-again-source.md",
      "sha256": "7af814bf2cd85e7440edec3184c9e505435e77ebf8d7fad2359c3b2ed884e961"
    },
    {
      "id": "source-3",
      "path": "control-plane/ad-hoc/ADHOC-tic-tac-toe-d45a/assets/history/003-runtime-browser-source.md",
      "sha256": "3546cbb855ed4253554279579fe77387fb3eaccfe03310fe79b5f2db2e44e616"
    },
    {
      "id": "source-4",
      "path": "control-plane/ad-hoc/ADHOC-tic-tac-toe-d45a/assets/history/005-confirmed-defaults-source.md",
      "sha256": "677069c28c0a4c38ba1772b07b82c664fd8c82a29f1465615b8488424e9f90b8"
    },
    {
      "id": "source-5",
      "path": "control-plane/ad-hoc/ADHOC-tic-tac-toe-d45a/assets/history/008-design-targets-source.md",
      "sha256": "46d3113d1fd032c0a194c49229f11a956bf1b2de43b49f01e38df51d40417726"
    }
  ],
  "changes": [
    {
      "change_id": "CHG-0001",
      "operation": "add",
      "target": {
        "type": "canon_record",
        "id": "CR-ADHOC-tic-tac-toe-d45a-0001"
      },
      "expected": {
        "state": "absent"
      },
      "value": {
        "id": "CR-ADHOC-tic-tac-toe-d45a-0001",
        "revision": 1,
        "kind": "definition",
        "title": "Human-player count",
        "scope": "repository",
        "authority_status": "proposed",
        "sources": [
          "source-1"
        ],
        "selection_rationale": "This term has a specific game meaning that affects interpretation and is reused by the requirements.",
        "content": {
          "term": "Human-player count",
          "meaning": "The number of human-controlled marks in a game: zero, one or two. Zero players means zero human players; X and O still exist and are controlled by AI.",
          "applies_to": "This local tic-tac-toe feature",
          "aliases": [
            "0 players means 0 human players"
          ]
        }
      },
      "rationale": "Introduce this source-backed meaning into the empty repository Canon.",
      "sources": [
        "source-1"
      ]
    },
    {
      "change_id": "CHG-0002",
      "operation": "add",
      "target": {
        "type": "canon_record",
        "id": "CR-ADHOC-tic-tac-toe-d45a-0002"
      },
      "expected": {
        "state": "absent"
      },
      "value": {
        "id": "CR-ADHOC-tic-tac-toe-d45a-0002",
        "revision": 1,
        "kind": "definition",
        "title": "Unbeatable AI",
        "scope": "repository",
        "authority_status": "proposed",
        "sources": [
          "source-1"
        ],
        "selection_rationale": "This term has a specific game meaning that affects interpretation and is reused by the requirements.",
        "content": {
          "term": "Unbeatable AI",
          "meaning": "A computer-controlled player. Unbeatable means no loss from a fresh legal game against any legal opponent sequence as either X or O. A draw is valid, not a guarantee of victory. Two unbeatable AIs draw under standard rules. This does not select an algorithm or external AI service.",
          "applies_to": "This local tic-tac-toe feature",
          "aliases": [
            "computer-controlled opponent",
            "computer-controlled player"
          ]
        }
      },
      "rationale": "Introduce this source-backed meaning into the empty repository Canon.",
      "sources": [
        "source-1"
      ]
    },
    {
      "change_id": "CHG-0003",
      "operation": "add",
      "target": {
        "type": "canon_record",
        "id": "CR-ADHOC-tic-tac-toe-d45a-0003"
      },
      "expected": {
        "state": "absent"
      },
      "value": {
        "id": "CR-ADHOC-tic-tac-toe-d45a-0003",
        "revision": 1,
        "kind": "definition",
        "title": "Game",
        "scope": "repository",
        "authority_status": "proposed",
        "sources": [
          "source-1"
        ],
        "selection_rationale": "This term has a specific game meaning that affects interpretation and is reused by the requirements.",
        "content": {
          "term": "Game",
          "meaning": "One standard 3x3 round from an empty board until X wins, O wins or a draw. It is distinct from a browser session and implies no match or multi-game score.",
          "applies_to": "This local tic-tac-toe feature",
          "aliases": [
            "round"
          ]
        }
      },
      "rationale": "Introduce this source-backed meaning into the empty repository Canon.",
      "sources": [
        "source-1"
      ]
    },
    {
      "change_id": "CHG-0004",
      "operation": "add",
      "target": {
        "type": "canon_record",
        "id": "CR-ADHOC-tic-tac-toe-d45a-0004"
      },
      "expected": {
        "state": "absent"
      },
      "value": {
        "id": "CR-ADHOC-tic-tac-toe-d45a-0004",
        "revision": 1,
        "kind": "definition",
        "title": "Play again",
        "scope": "repository",
        "authority_status": "proposed",
        "sources": [
          "source-2"
        ],
        "selection_rationale": "This term has a specific game meaning that affects interpretation and is reused by the requirements.",
        "content": {
          "term": "Play again",
          "meaning": "Play again is a person's explicit action beginning another game after termination. In zero-human mode the person triggers replay without controlling either mark. Replay is not automatic.",
          "applies_to": "This local tic-tac-toe feature",
          "aliases": [
            "Play again"
          ]
        }
      },
      "rationale": "Introduce this source-backed meaning into the empty repository Canon.",
      "sources": [
        "source-2"
      ]
    },
    {
      "change_id": "CHG-0005",
      "operation": "add",
      "target": {
        "type": "canon_record",
        "id": "CR-ADHOC-tic-tac-toe-d45a-0005"
      },
      "expected": {
        "state": "absent"
      },
      "value": {
        "id": "CR-ADHOC-tic-tac-toe-d45a-0005",
        "revision": 1,
        "kind": "functional_requirement",
        "title": "Rules",
        "scope": "repository",
        "authority_status": "proposed",
        "sources": [
          "source-1"
        ],
        "selection_rationale": "This is independently observable game behavior required by the cited sources and retained planning interpretation.",
        "content": {
          "obligation": "Use nine cells in a 3x3 board. X starts; X and O alternate, placing one mark in an empty cell. Three identical marks in a row, column or diagonal win. A full board without a winner draws. A winning final move takes precedence over draw; terminal games accept no moves.",
          "rationale": "Required behavior for the selected standard game and interaction modes.",
          "acceptance_direction": "All eight winning lines for both marks; Full-board draw and winning ninth move; Occupied-cell rejection, X-first alternation and terminal immutability"
        }
      },
      "rationale": "Introduce this source-backed meaning into the empty repository Canon.",
      "sources": [
        "source-1"
      ]
    },
    {
      "change_id": "CHG-0006",
      "operation": "add",
      "target": {
        "type": "canon_record",
        "id": "CR-ADHOC-tic-tac-toe-d45a-0006"
      },
      "expected": {
        "state": "absent"
      },
      "value": {
        "id": "CR-ADHOC-tic-tac-toe-d45a-0006",
        "revision": 1,
        "kind": "acceptance_scenario",
        "title": "Verify rules",
        "scope": "repository",
        "authority_status": "proposed",
        "sources": [
          "source-1"
        ],
        "selection_rationale": "The retained acceptance criteria need an explicit stable verification target without hiding them in narrative or losing them during schema conversion.",
        "content": {
          "given_context": "A legal board is in a winning, draw, occupied-cell or terminal test position.",
          "when_action": "The next permitted or prohibited move is attempted.",
          "then_observable_result": "All eight winning lines for both marks; Full-board draw and winning ninth move; Occupied-cell rejection, X-first alternation and terminal immutability",
          "limitations": [
            "Planning criteria only; no implementation test result is claimed."
          ]
        }
      },
      "rationale": "Introduce this source-backed meaning into the empty repository Canon.",
      "sources": [
        "source-1"
      ]
    },
    {
      "change_id": "CHG-0007",
      "operation": "add",
      "target": {
        "type": "canon_relationship",
        "kind": "verified_by",
        "from": {
          "id": "CR-ADHOC-tic-tac-toe-d45a-0005",
          "revision": 1
        },
        "to": {
          "id": "CR-ADHOC-tic-tac-toe-d45a-0006",
          "revision": 1
        }
      },